[
  {
    "id": "2026-054996",
    "title": "Sähkötyöt vuosisopimusperiaatteella 1.11.2026-30.10.2028, mahdolliset optiot 2029 ja 2030",
    "organisation": "Vihdin kunta",
    "publishedAt": "2026-08-18",
    "go_no_go_suositus": "GO",
    "perustelu": "Selkeä sähköurakoinnin puitehankinta, joka kattaa kiinteistöjen sähkötekniset perustyöt, heikkovirtatyöt sekä palo- ja turvajärjestelmiin liittyvät työt. Soveltuu hyvin yleiselle sähköurakoitsijalle, jos vakuus- ja osa-aluekohtaiset ehdot täyttyvät.",
    "liikevaihto_vaatimus_eur": null,
    "liikevaihto_evidenssi": "Julkisessa Hilma-ilmoitustekstissä ei yksilöidä tarjoajan vähimmäisliikevaihtovaatimusta. Hankinnan ennakoitu arvo on 5 400 000 euroa koko puitejärjestelylle, mutta tämä ei ole tarjoajan liikevaihtovaatimus.",
    "pakolliset_vaatimukset": [
      "Yli 25 000 euron kohteissa urakoitsijalta vaaditaan kohdekohtainen rakennusajan vakuus",
      "Yli 25 000 euron kohteissa urakoitsijalta vaaditaan kohdekohtainen takuuajan vakuus",
      "Työt toteutetaan YSE 1998 -ehtojen ja hankekohtaisten urakka-asiakirjojen mukaisesti"
    ],
    "vaatimukset_evidenssi": "Hilma-ilmoituksen mukaan yli 25 000 euron kohteissa edellytetään kohdekohtaisia rakennus- ja takuuajan vakuuksia. Lisäksi työt tehdään YSE 1998 -ehtojen sekä hankekohtaisten urakka-asiakirjojen mukaisesti.",
    "sopimusriskit": [
      "Kohdekohtaiset rakennus- ja takuuajan vakuudet sitovat käyttöpääomaa yli 25 000 euron toimeksiannoissa",
      "Puitesopimukseen valitaan 4-5 toimittajaa, joten sopimus ei takaa yksittäiselle toimittajalle tiettyä työmäärää",
      "Sopimukseen sisältyy kaksi mahdollista yhden vuoden optiota"
    ],
    "riskit_evidenssi": "Hilma-ilmoituksessa todetaan, että hankintaan valitaan 4-5 sopimuskumppania, yli 25 000 euron kohteissa vaaditaan vakuudet ja peruskautta voidaan jatkaa kahdella yhden vuoden optiolla.",
    "deadline": "2026-09-17T12:00:00+03:00",
    "hilma_url": null,
    "source_url": "https://tarjouspalvelu.fi/UX/TP/SiirryTarjouspyyntoon/?tpId=623920",
    "hard_gates": [
      {
        "id": "capability-electric",
        "type": "capability",
        "label": "Sähköurakoinnin kyvykkyys",
        "required_value": "sähkötyöt",
        "evidence": "Hankinta koskee Vihdin kunnan kiinteistöjen sähköteknisiä vuosikorjaustöitä."
      },
      {
        "id": "financial-guarantee",
        "type": "financial_guarantee",
        "label": "Rakennus- ja takuuajan vakuus yli 25 000 € kohteissa",
        "required_value": true,
        "evidence": "Yli 25 000 euron kohteissa vaaditaan kohdekohtainen rakennusajan ja takuuajan vakuus."
      }
    ]
  },
  {
    "id": "2026-053903",
    "title": "Jyväskylän Seudun Puhdistamo Oy:n rakennus-, LVIS-, koneisto- ja putkistotöiden puitesopimus vuosille 2026-2028 (optio 2028-2030)",
    "organisation": "Jyväskylän Seudun Puhdistamo Oy",
    "publishedAt": "2026-08-21",
    "go_no_go_suositus": "GO",
    "perustelu": "Erittäin relevantti LVI- ja sähköurakoitsijalle, koska puitesopimuksessa on omat osa-alueet LVI-töille ja sähkötöille ja tarjoaja voi tarjota yhtä tai useampaa osa-aluetta. Tarkat soveltuvuusvaatimukset on kuitenkin tarkistettava tarjousasiakirjoista.",
    "liikevaihto_vaatimus_eur": null,
    "liikevaihto_evidenssi": "Julkisessa ilmoituksessa hankinnan arvoa tai tarjoajan vähimmäisliikevaihtovaatimusta ei ole julkaistu.",
    "pakolliset_vaatimukset": [
      "Tarjous annetaan valitulle yhdelle tai useammalle osa-alueelle tarjouspyyntöasiakirjojen mukaisesti"
    ],
    "vaatimukset_evidenssi": "Hilma-aineiston mukaan puitesopimus jakautuu viiteen osa-alueeseen, joista osa-alue 3 on LVI-työt ja osa-alue 4 sähkötyöt. Tarjoaja voi tarjota yhtä tai useampaa osa-aluetta; tarkemmat vaatimukset ovat tarjouspyyntöasiakirjoissa.",
    "sopimusriskit": [
      "Puitejärjestely ei itsessään takaa tiettyä toimeksiantomäärää",
      "Jätevedenpuhdistamoympäristö voi edellyttää tavallista kiinteistöurakointia laajempaa prosessi- ja työturvallisuusosaamista",
      "Optiokausi 2028-2030 on tilaajan valinnassa"
    ],
    "riskit_evidenssi": "Ilmoitus koskee jätevedenpuhdistamoihin liittyviä rakennus-, LVIS-, koneisto- ja putkistotöitä vuosille 2026-2028 sekä mahdollista optiota 2028-2030. Tarkemmat ehdot on siirretty tarjouspyyntöasiakirjoihin.",
    "deadline": "2026-09-25",
    "hilma_url": "https://www.hankintailmoitukset.fi/fi/public/procurement/35533/notice/53903",
    "source_url": "https://www.hankintailmoitukset.fi/fi/public/procurement/35533/notice/53903",
    "hard_gates": [
      {
        "id": "capability-lvis",
        "type": "capability_any",
        "label": "Soveltuva LVI- tai sähköosaaminen",
        "required_value": [
          "LVI",
          "sähkötyöt"
        ],
        "evidence": "Puitejärjestelyn osa-alue 3 on LVI-työt ja osa-alue 4 sähkötyöt."
      }
    ]
  },
  {
    "id": "2026-054303",
    "title": "Kiinteistöjen rakennuspalveluita koskeva puitejärjestely OSA-ALUE 1 RU, OSA-ALUE 2 SÄH, OSA-ALUE 3 LVIA",
    "organisation": "Kokkolan kaupunki",
    "publishedAt": "2026-08-08",
    "go_no_go_suositus": "GO",
    "perustelu": "Selkeä ICP-osuma sekä sähkö- että LVIA-urakoitsijalle. Hankinta on jaettu erillisiin SÄH- ja LVIA-osa-alueisiin, joten tarjoajan ei tarvitse kattaa koko rakennusurakointia.",
    "liikevaihto_vaatimus_eur": null,
    "liikevaihto_evidenssi": "Julkisessa ilmoitustekstissä ei ilmoiteta tarjoajan vähimmäisliikevaihtovaatimusta eikä hankinnan kokonaisarvoa.",
    "pakolliset_vaatimukset": [
      "Tarjouksen hinnat ilmoitetaan osa-aluekohtaisesti tuntihintojen painotettuna keskiarvona ja kateprosenttina Hinnat-liitteellä",
      "Tarjous ja toimeksiannot toteutetaan valitun osa-alueen tarjouspyyntöasiakirjojen mukaisesti"
    ],
    "vaatimukset_evidenssi": "Ilmoituksessa hankinta jaetaan rakennustöihin, sähkötöihin ja LVIA-töihin. Vertailussa käytetään osa-alueittain tuntihintojen painotettua keskiarvoa ja kateprosenttia, jotka annetaan Hinnat-liitteellä.",
    "sopimusriskit": [
      "Puitejärjestelyyn valitaan enintään viisi urakoitsijaa, joten sopimus ei takaa yksittäiselle toimittajalle tiettyä volyymia",
      "Hinnoittelu perustuu tuntihintojen ja kateprosentin kilpailuun",
      "Sopimuskausi 24 kuukautta ja kaksi mahdollista 12 kuukauden optiota"
    ],
    "riskit_evidenssi": "Ilmoituksen mukaan muodostetaan enintään viiden urakoitsijan puitejärjestely. Sopimus on voimassa 24 kuukautta ja sitä voidaan jatkaa kahdella 12 kuukauden optiokaudella.",
    "deadline": "2026-09-04",
    "hilma_url": null,
    "source_url": "https://fi.openprocurements.com/tender/kiinteistojen-rakennuspalveluita-koskeva-puitejarjestely-osa-alue-1-ru-osa-alue-2-sah-osa-alue-3-lvi/",
    "hard_gates": [
      {
        "id": "capability-kokkola",
        "type": "capability_any",
        "label": "SÄH- tai LVIA-osaaminen",
        "required_value": [
          "sähkötyöt",
          "LVIA"
        ],
        "evidence": "Hankinnan osa-alueet 2 ja 3 ovat sähkötyöt ja LVIA-työt."
      }
    ]
  },
  {
    "id": "2026-055952",
    "title": "Sprinkleri- ja kaasusammutuslaitteistojen huolto sekä pienet lisä- ja muutostyöt",
    "organisation": "Pirkanmaan hyvinvointialue",
    "publishedAt": "2026-09-02",
    "go_no_go_suositus": "NO-GO",
    "perustelu": "Hankinta on LVI-/kiinteistötekniikan rajapinnassa, mutta kohdistuu erikoistuneesti sprinkleri- ja kaasusammutusjärjestelmien testaukseen, määräaikaishuoltoon ja muutostöihin. Yleiselle LVI-/sähköurakoitsijalle tämä on NO-GO ilman nimenomaista sammutusjärjestelmäosaamista.",
    "liikevaihto_vaatimus_eur": null,
    "liikevaihto_evidenssi": "Julkisessa Hilma-ilmoitustekstissä ei yksilöidä tarjoajan vähimmäisliikevaihtovaatimusta.",
    "pakolliset_vaatimukset": [],
    "vaatimukset_evidenssi": "Julkisessa ilmoitustekstissä kuvataan testaus-, määräaikaishuolto- sekä vähäiset lisä- ja muutostyöt, mutta tarjoajan yksityiskohtaisia pätevyys- tai sertifikaattivaatimuksia ei julkaista tässä näkymässä. Ne on tarkistettava tarjousasiakirjoista.",
    "sopimusriskit": [
      "Sopimusalueen kohdemäärä voi muuttua sopimuskauden aikana",
      "Puitejärjestely voi ulottua myöhemmin Pirhan ylläpitovastuulle siirtyviin uusiin kohteisiin",
      "Erikoisjärjestelmien huoltovastuu kasvattaa virhe- ja turvallisuusriskiä"
    ],
    "riskit_evidenssi": "Ilmoituksessa todetaan, että Pirhan ylläpitovastuulla olevia kohteita voi poistua tai tulla lisää sopimuskauden aikana ja puitesopimusta voidaan käyttää myös myöhemmin ylläpitovastuulle siirtyvissä kohteissa.",
    "deadline": "2026-10-02",
    "hilma_url": "https://www.hankintailmoitukset.fi/fi/public/procurement/36521/notice/55952",
    "source_url": "https://www.hankintailmoitukset.fi/fi/public/procurement/36521/notice/55952",
    "hard_gates": [
      {
        "id": "capability-fire",
        "type": "capability",
        "label": "Sprinkleri- ja kaasusammutusjärjestelmien huolto-osaaminen",
        "required_value": "sammutusjärjestelmät",
        "evidence": "Hankinta koskee sprinkleri- ja kaasusammutuslaitteistojen testaus- ja määräaikaishuoltoja."
      }
    ]
  },
  {
    "id": "2026-054740",
    "title": "Kylmäteknisten laitteiden huoltopalvelut",
    "organisation": "CSC - Tieteen tietotekniikan keskus Oy",
    "publishedAt": "2026-08-15",
    "go_no_go_suositus": "NO-GO",
    "perustelu": "Hankinta kohdistuu LUMI-datakeskuksen lämpöpumppujen ja vedenjäähdyttimien määräaikaishuoltoon ja korjauksiin. Tämä on teknisesti relevantti vain kylmätekniikkaan erikoistuneelle toimijalle; yleiselle LVI-/sähköurakoitsijalle NO-GO ilman kylmälaiteosaamista.",
    "liikevaihto_vaatimus_eur": null,
    "liikevaihto_evidenssi": "Julkisessa Hilma-aineistossa ei ilmoiteta tarjoajan vähimmäisliikevaihtovaatimusta.",
    "pakolliset_vaatimukset": [],